<?xml version="1.0" encoding="UTF-8"?>
<!DOCTYPE tienda SYSTEM "402repaso.dtd">
<tienda>
    <productos>
        <producto idP="P1" ean="5397063521906" iva="general">
            <titulo>Portátil Dell XPS 15</titulo>
            <fabricante>Dell</fabricante>
            <modelo>XPS 15</modelo>
            <precio divisa="EUR">1000</precio>
            <stock>20</stock>
            <reacondicionado />
        </producto>
        <producto idP="P2" iva="general">
            <titulo>Tablet Samsung Galaxy Tab S7</titulo>
            <marca>Samsung</marca>
            <modelo>Galaxy Tab S7</modelo>
            <precio divisa="EUR">700</precio>
            <stock>15</stock>
        </producto>
        <producto idP="P3" ean="0889894812605" iva="general">
            <titulo>Impresora HP OfficeJet Pro 7740</titulo>
            <fabricante>HP</fabricante>
            <modelo>OfficeJet Pro 7740</modelo>
            <precio divisa="EUR" descuento="10">150</precio>
            <stock>10</stock>
        </producto>
    </productos>
    <clientes>
        <cliente idC="C1" creado="25-12-2022">
            <nombre>Antonio</nombre>
            <apellidos>Pérez Martínez</apellidos>
            <dni>12345678A</dni>
            <telefono>666555444</telefono>
            <direccion>Avenida de Romero Donallo, 13</direccion>
        </cliente>
        <cliente idC="C2" creado="12-12-2022">
            <nombre-completo>María García Pérez</nombre-completo>
            <dni>87654321B</dni>
            <telefono>755444333</telefono>
            <telefono>655444333</telefono>
            <direccion>Calle Santiago de Chile, 45</direccion>
        </cliente>
        <cliente idC="C3" creado="03-01-2022">
            <nombre>Mario</nombre>
            <apellidos>Martínez López</apellidos>
            <dni>318343578A</dni>
        </cliente>
    </clientes>
    <ventas>
        <venta fecha="09-01-2023" cliente="C2">
            <item ref="P3" cantidad="8" />
            <item ref="P2" />
            <total divisa="EUR">1900</total>
        </venta>
        <venta fecha="21-01-2023" cliente="C1">
            <item ref="P1" />
            <item ref="P2" />
            <total divisa="EUR">1700</total>
        </venta>
    </ventas>
</tienda>